{
  "name": "archaeology",
  "version": "1.4.0",
  "description": "Dig through Claude Code session history — survey projects, extract domain patterns, analyse workstyles, and conserve narrative artifacts.",
  "license": "MIT",
  "author": { "name": "Ben Purslow" },
  "keywords": ["archaeology", "history", "patterns", "survey", "workstyle", "conservation", "excavation", "dig", "conserve", "nuggets", "spelunk"]
}
