{
  "name": "api-toolkit",
  "version": "1.1.0",
  "description": "Comprehensive API development tools for generating endpoints, documentation, and testing",
  "author": {
    "name": "Backend Team",
    "email": "backend@company.com"
  },
  "homepage": "https://github.com/company/api-toolkit",
  "repository": "https://github.com/company/api-toolkit",
  "license": "Apache-2.0",
  "keywords": [
    "api",
    "openapi",
    "documentation",
    "endpoints"
  ]
}
